{
  "$schema": "http://json-schema.org/draft-07/schema#",
  "title": "Generated schema for Root",
  "type": "object",
  "properties": {
    "alerts": {"type": "array"},
    "assignedTo": {"type": ["string", "null"]},
    "classification": {"type": "string"},
    "comments": {
      "type": "array",
      "items": {
        "type": "object",
        "properties": {
          "comment": {"type": "string"},
          "createdBy": {"type": "string"},
          "createdTime": {"type": "string"}
        },
        "required": [
          "comment",
          "createdBy",
          "createdTime"
        ]
      }
    },
    "createdTime": {"type": "string"},
    "determination": {"type": "string"},
    "impactedEntities": {
      "type": "object",
      "properties": {
        "machines": {
          "type": "number"
        },
        "mailboxes": {"type": "number"},
        "users": {"type": "number"}
      },
      "required": [
        "machines",
        "mailboxes",
        "users"
      ]
    },
    "incidentId": {"type": "string"},
    "incidentName": {"type": "string"},
    "lastUpdateTime": {"type": "string"},
    "mitreTechniques": {
      "type": "array",
      "items": {"type": "string"}
    },
    "severity": {"type": "string"},
    "status": {"type": "string"},
    "summary": {"type": "string"},
    "tags": {
      "type": "array",
      "items": {"type": "string"}
    },
    "threatFamily": {"type": "string"}
  },
  "required": [
    "alerts",
    "assignedTo",
    "classification",
    "comments",
    "createdTime",
    "determination",
    "impactedEntities",
    "incidentId",
    "incidentName",
    "lastUpdateTime",
    "mitreTechniques",
    "severity",
    "status",
    "summary",
    "tags",
    "threatFamily"
  ]
}